Name,Price,Rating
रोष (Hindi Edition),89,4.0 out of 5 stars
Mindset - Hindi,235,4.4 out of 5 stars
"इकिगाई | Ikigai (Hindi) | दीर्घायु, तंदुरुस्त और आनंदित जीवन का जापानी रहस्य | Hector Garcia | Fransesc Miralles | Art of staying Young.. while growing Old",234,4.5 out of 5 stars
JEEVAN KE ADHBHUT RAHASYA (HINDI),158,4.5 out of 5 stars
Aughad - Hindi,188,4.5 out of 5 stars
"Best of Hindi Short Stories (Set of 4 books) - Premchand, Jaishankar Prasad, Sarat Chandra, Rabindranath Tagore",387,4.4 out of 5 stars
Aapke Avchetan Man Ki Shakti(Hindi Translation of The Power of Your Subconscious Mind),99,4.4 out of 5 stars
"Swami Vivekanand (Set of 4 Books) (Hindi) - Karmyog, Rajyog, Gyanyog, Bhaktiyog",392,4.6 out of 5 stars
Meri Pratham Hindi Sulekh Varnmala,109,4.4 out of 5 stars
The Power of A Positive Attitude Hindi,109,4.2 out of 5 stars
"Sabse Mushkil Kaam, Sabse Pehle (Hindi Edition of Eat That Frog!)",161,4.5 out of 5 stars
Sapiens Manav Jati ka Sankshipt Itihas,416,4.5 out of 5 stars
Saat Chiranjeevi (Hindi Edition),0,4.1 out of 5 stars
"Dhan Sampatti Ka Manovigyan (The Psychology Of Money) [Paperback] Housel, Morgan and Asma",180,4.3 out of 5 stars
"108 Akbar and Birbal Stories (Illustrated) (Hindi) - Story Book for Kids - Classic Tales of India - Bedtime Stories - 3 Years to 10 Years Old - Hindi Short Stories for Children - Read Aloud to Infants, Toddlers",116,4.4 out of 5 stars
Jaun Elia: Ek Ajab Ghazab Shayar । जौन एलिया : एक अजब-ग़ज़ब शायर (Hindi Edition),0,4.6 out of 5 stars
Hindi Sulekh - Varanmala - Handwriting Practice Workbook for Kids 3-6 Years Old,108,4.4 out of 5 stars
"108 Stories from the Vedas, the Puranas and the Upanishads for Children (Illustrated) (Hindi) - Story Book for Kids - Bedtime Stories - 4 Years to 10 ... Children - Read Aloud to Infants, Toddlers",128,4.4 out of 5 stars
Bharat Ka Samvidhan (The Constitution of India) in Hindi,150,4.3 out of 5 stars
"The Hidden Hindu Book 1 and 2 ""द हिडन हिंदू- 1 और 2"" - अक्षत गुप्ता - Akshat Gupta (Set of 2 Hindi Books)",329,4.5 out of 5 stars
Godaan - Hindi,203,4.5 out of 5 stars
The Hidden Hindu (Hindi Translation of The Hidden Hindu) Paperback,150,4.5 out of 5 stars
